{
  "schemaVersion": 1,
  "format": "hybridclr.dhe-toolchain-layout.json",
  "toolchainVersion": "0.1.35",
  "contractVersion": 1,
  "exactPaths": [
    ".gitattributes",
    "Directory.Build.props",
    "Directory.Build.targets",
    "tool/HybridCLR.DheTool.csproj",
    "tool/Program.cs",
    "tool/UnityToolBundle.cs",
    "tool/ToolPublicationPolicy.cs",
    "tool/ToolOutputProtection.cs",
    "docs/DHE-Tool-Binary-Notices.md",
    "tool/SchemaValidation.cs",
    "tool/ArchiveSupport.cs",
    "tool/ProductionGates.cs",
    "tool/RuntimeSourceBinding.cs",
    "tool/UnityBatchLog.cs",
    "tool/MetaVersion.cs",
    "tool/ResourceUpdateCompatibility.cs",
    "tool/ResourceUpdateStaging.cs",
    "tool/DhePlayerDispatch.cs",
    "tool/ResourceReleaseGate.cs",
    "tool/EvidenceAuthorities.cs",
    "tool/ChannelState.cs",
    "tool/AndroidDeviceSmoke.cs",
    "tool/BaseRegistry.cs",
    "tool/ReleaseLedger.cs",
    "tool/ResourceReleaseBuild.cs",
    "tool/ResourceReleasePlanning.cs",
    "tool/ResourceReleaseQualification.cs",
    "tool/LabCommands.cs",
    "tool/ManagedCaseVariants.cs",
    "tool/dnlib.dll",
    "docs/HybridCLR-DHE-Toolchain.md",
    "docs/HybridCLR-DHE-Android-Device-Overlay.md",
    "docs/HybridCLR-DHE-Formal-Project-Validation.md",
    "docs/HybridCLR-DHE-Resource-Only-Design.md",
    "docs/HybridCLR-DHE-Runtime-Source-Binding.md",
    "docs/HybridCLR-DHE-Release-Ledger-Design.md",
    "docs/HybridCLR-DHE-Evidence-Authority-Set-Design.md",
    "docs/HybridCLR-DHE-Base-Onboarding-Design.md",
    "docs/HybridCLR-DHE-Multi-Base-Qualification-Design.md",
    "docs/HybridCLR-DHE-Resource-Release-Planning-Design.md",
    "docs/HybridCLR-DHE-Workflow-Review.md",
    "docs/THIRD-PARTY-NOTICES.md",
    "manifests/dhe-package-lock.json",
    "manifests/dhe-toolchain-layout.json",
    "manifests/dhe-toolchain-evidence-authorities.json",
    "manifests/repo-lock.json",
    "manifests/runtime-workflows.json",
    "schemas/dhe-adapter-native-finalize.schema.json",
    "schemas/dhe-adapter-native-guards.schema.json",
    "schemas/dhe-adapter-player-build.schema.json",
    "schemas/dhe-adapter-stage.schema.json",
    "schemas/dhe-archive-gate.schema.json",
    "schemas/dhe-archive-manifest.schema.json",
    "schemas/dhe-aot-metadata-manifest.schema.json",
    "schemas/dhe-base-registry.schema.json",
    "schemas/dhe-channel-state.schema.json",
    "schemas/dhe-channel-snapshot.schema.json",
    "schemas/dhe-device-player-run.schema.json",
    "schemas/dhe-release-ledger.schema.json",
    "schemas/dhe-resource-evidence.schema.json",
    "schemas/dhe-resource-player-workflow.schema.json",
    "schemas/dhe-resource-release-gate.schema.json",
    "schemas/dhe-resource-release-build-config.schema.json",
    "schemas/dhe-resource-release-build.schema.json",
    "schemas/dhe-base-runner-catalog.schema.json",
    "schemas/dhe-resource-release-plan-config.schema.json",
    "schemas/dhe-resource-release-plan.schema.json",
    "schemas/dhe-resource-release-qualification-config.schema.json",
    "schemas/dhe-resource-release-qualification.schema.json",
    "schemas/dhe-resource-update.schema.json",
    "schemas/dhe-resource-update-validation.schema.json",
    "schemas/dhe-resource-stage.schema.json",
    "schemas/dhe-artifact-validation.schema.json",
    "schemas/dhe-baseline-manifest.schema.json",
    "schemas/dhe-batch-report.schema.json",
    "schemas/dhe-build-identity.schema.json",
    "schemas/dhe-clean-checkout-gate.schema.json",
    "schemas/dhe-cpp-resolver-regression.schema.json",
    "schemas/dhe-metaversion.schema.json",
    "schemas/dhe-native-gate.schema.json",
    "schemas/dhe-native-manifest.schema.json",
    "schemas/dhe-package-lock.schema.json",
    "schemas/dhe-player-result.schema.json",
    "schemas/dhe-project-adapter-prepare.schema.json",
    "schemas/dhe-project-plan-validation.schema.json",
    "schemas/dhe-project-plan.schema.json",
    "schemas/dhe-project-preflight-failure.schema.json",
    "schemas/dhe-project-preflight.schema.json",
    "schemas/dhe-project-workflow-failure.schema.json",
    "schemas/dhe-project-workflow.schema.json",
    "schemas/dhe-regression.schema.json",
    "schemas/dhe-release-gate.schema.json",
    "schemas/dhe-runtime-lock.schema.json",
    "schemas/dhe-runtime-manifest.schema.json",
    "schemas/dhe-runtime-handoff-plan.schema.json",
    "schemas/dhe-runtime-plan.schema.json",
    "schemas/dhe-schema-gate.schema.json",
    "schemas/dhe-schema-validation.schema.json",
    "schemas/dhe-source-boundary.schema.json",
    "schemas/dhe-source-preflight.schema.json",
    "schemas/dhe-toolchain-doctor.schema.json",
    "schemas/dhe-toolchain-evidence-authorities.schema.json",
    "schemas/dhe-toolchain-gate.schema.json",
    "schemas/dhe-toolchain-install.schema.json",
    "schemas/dhe-toolchain-layout.schema.json",
    "schemas/dhe-toolchain-manifest.schema.json",
    "schemas/dhe-toolchain-release-evidence.schema.json",
    "schemas/dhe-workflow-failure.schema.json",
    "schemas/dhe-workflow-report.schema.json",
    "schemas/dhe-workflow-config.schema.json",
    "schemas/dhe-yooasset-build.schema.json",
    "templates/DheWorkflowBuild.cs",
    "templates/DheBuildIdentity.cs",
    "templates/dhe-workflow-config.json",
    "templates/dhe-resource-release-build-config.json",
    "templates/dhe-base-runner-catalog.json",
    "templates/dhe-resource-release-plan-config.json",
    "templates/dhe-resource-release-qualification-config.json"
  ],
  "prefixes": [
    "patches/dhe-lite/",
    "tool/"
  ],
  "generatedPaths": [
    "dhe-source-boundary.json",
    "dhe-toolchain-manifest.json"
  ],
  "commands": [
    "assemble-runtime",
    "archive",
    "aot-metadata-manifest",
    "android-device-smoke",
    "baseline-manifest",
    "batch",
    "base-registry",
    "resource-release-build",
    "resource-release-plan",
    "resource-release-qualify",
    "resource-update",
    "stage-resource-update",
    "resource-player-evidence",
    "resource-release-gate",
    "channel-state",
    "bootstrap-repos",
    "build-managed-cases",
    "check-environment",
    "clear-unity-project-locks",
    "compare-results",
    "doctor",
    "file-hash",
    "generate-metadata-stress-source",
    "generate-test-manifest",
    "install",
    "mv",
    "native-tests",
    "new-adapter",
    "new-config",
    "preflight",
    "publish",
    "publish-unity-tool",
    "prepare-engine-test-project",
    "reference",
    "regression",
    "release-evidence",
    "release-gate",
    "schema-gate",
    "schema-validate",
    "tree-hash",
    "validate",
    "verify-package",
    "version",
    "wait-editor",
    "workflow"
  ]
}
